{
  "model_name": "GPT-5 (high)",
  "model_type": "llm",
  "analysis": "## Model Overview\n\n### Name, Creator, and Category\nThe model is named **GPT-5 (high)**, created by **OpenAI**. It is categorized as a multimodal, transformer-based large language model designed as a unified system with multiple specialized sub-models, optimized for complex reasoning, coding, and multimodal tasks with large context windows.\n\n### Key Specifications and Capabilities\n- **Release Date:** 2025-08-07.\n- **Core Capabilities:** Supports multimodal inputs including text, code, images, and possibly audio/video. It excels in complex reasoning, coding, and agentic functionality, such as autonomous web search and desktop setup. The model features adjustable reasoning effort (low to high) and verbosity (low to high), enabling efficient handling of simple and complex tasks.\n- **Performance Metrics:** Median output tokens per second: 148.741; Median time to first answer token: 57.845 seconds; Median time to first token: 57.845 seconds.\n- **Context Window:** Up to around 256,000 tokens in GPT-5 Pro, with some reports up to 300kâ400k tokens, allowing processing of very large documents and extended multi-turn conversations.\n- **Training:** Trained with large-scale unsupervised learning and fine-tuned using reinforcement learning from human feedback (RLHF), with adaptive compute allocation.\n\n## Performance Analysis\n\n### Benchmarks and Scores\nThe model demonstrates strong performance across various benchmarks, as detailed in the evaluations:\n- **AIME:** 0.957\n- **AIME_25:** 0.943\n- **Artificial Analysis Coding Index:** 52.7\n- **Artificial Analysis Intelligence Index:** 68.5\n- **Artificial Analysis Math Index:** 94.3\n- **GPQA:** 0.854\n- **HLE:** 0.265\n- **IFBench:** 0.731\n- **LCR:** 0.756\n- **LiveCodeBench:** 0.846\n- **Math_500:** 0.994\n- **MMLU Pro:** 0.871\n- **SciCode:** 0.429\n- **Tau2:** 0.848\n- **TerminalBench Hard:** 0.305\n\nAdditional performance highlights include:\n- 74.9% on SWE-bench Verified.\n- Approximately 88% on polyglot coding benchmarks.\n- 50-80% reduction in output tokens compared to models like OpenAI's \"o3\" variant while maintaining or improving performance.\n- 45% fewer factual errors than GPT-4o in web-enabled scenarios, and up to 80% fewer errors in \"thinking\" mode.\n- Tool calling success rate of 96.7% on telecom benchmarks.\n- Outperforms earlier models in front-end coding tasks about 70% of the time in internal tests.\n- Incremental reduction in hallucination rates by about 6-fold compared to prior best models.\n- Achieves better results with fewer tokens and significantly reduced hallucination rates due to the larger context window.\n\n### Comparisons with Similar Models\nThe provided data indicates that GPT-5 (high) surpasses previous OpenAI models, such as GPT-4o and the \"o3\" variant, in accuracy and efficiency. It shows a 50-80% reduction in output tokens while maintaining or improving performance over the \"o3\" variant, 45% fewer factual errors than GPT-4o, and up to 80% fewer errors in thinking mode. It outperforms earlier models by about 70% in front-end coding tasks and achieves half the tool-calling error rate compared to frontier models. No direct benchmark scores for other specific models are provided for side-by-side comparison beyond these relative improvements.\n\n## Technical Details\n\n### Architecture Insights\nGPT-5 (high) consists of several specialized sub-models:\n- *gpt-5-main* and *gpt-5-main-mini* for fast, high-throughput tasks.\n- *gpt-5-thinking*, *gpt-5-thinking-mini*, and *gpt-5-thinking-nano* for deeper reasoning.\nA real-time router selects the most appropriate model based on task type, complexity, tools needed, and user intent. It supports multimodal inputs via modality-specific encoders and a shared transformer backbone. The system integrates adaptive compute allocation for efficient task handling and enhanced agentic capabilities for autonomous interaction, such as browsing and desktop setup. Improved multimodal fusion allows seamless integration of text, images, and potential audio.\n\n### Input/Output Specifications\n- **Inputs:** Multimodal, including text, code, images, and possibly audio/video, with a context window of up to 256,000â400,000 tokens.\n- **Outputs:** Generated text, code, and multimodal responses, with adjustable reasoning effort and verbosity. Median output tokens per second: 148.741. Supports tool calling with a 96.7% success rate on telecom benchmarks and reduced output tokens (50-80% fewer) compared to prior models.\n\nInformation on exact parameter counts or training dataset sizes is not available in the provided data.\n\n## Pricing & Availability\n\n### Cost Structure and Pricing Tiers\nPricing is structured as follows:\n- Price per 1M blended 3:1 tokens: $3.438.\n- Price per 1M input tokens: $1.25.\n- Price per 1M output tokens: $10.\nVariant models (e.g., mini/nano) provide cost/performance trade-offs, but specific tier details beyond API access are not fully disclosed publicly. It is designed for commercial deployment with typical OpenAI usage models.\n\n### Availability and Access Methods\nGPT-5 (high) is accessible through:\n- OpenAI API, with multiple modes including adjustable reasoning effort and verbosity.\n- ChatGPT integrations, offering variants like GPT-5-thinking-pro.\n- Microsoft Azure AI platform and Microsoft applications.\nAPI access is available for developers. No related models were discovered in the provided data.\n\n## Use Cases & Applications\n\n### Recommended Applications Based on Performance Data\nBased on its high benchmarks in math (e.g., Math_500: 0.994, Artificial Analysis Math Index: 94.3), coding (e.g., LiveCodeBench: 0.846, Artificial Analysis Coding Index: 52.7), and reasoning (e.g., GPQA: 0.854, MMLU Pro: 0.871), recommended applications include:\n- **Coding and Software Development:** Debugging, code review, generation, explanation, and front-end web development, where it outperforms prior models 70% of the time.\n- **Multimodal Tasks:** Analyzing UI components and accessibility from screenshots, summarizing technical documents with visual data, and correlating written and visual evidence.\n- **Agentic Intelligence:** Autonomous browsing, tool use, and real-time information retrieval for operational workflows.\n- **Other Areas:** Large document analysis, multilingual and scientific reasoning, enhanced instruction following, and commercial deployment for complex reasoning tasks.\n\n### Strengths and Limitations\n**Strengths:** Exceptional performance in math and coding benchmarks, large context window reducing hallucinations (6-fold improvement), high tool-calling reliability (96.7%), and efficient token usage (50-80% reduction). Strong multimodal integration and agentic capabilities make it state-of-the-art for reasoning, coding, and task chaining.\n**Limitations:** Lower scores in certain areas like HLE (0.265), SciCode (0.429), and TerminalBench Hard (0.305) suggest potential weaknesses in specific scientific coding or hard terminal tasks. Median time to first token (57.845 seconds) may indicate latency for initial responses. No explicit limitations on context beyond the window size are provided, but reliance on routing for sub-model selection could introduce variability.\n\n## Community & Updates\n\n### Recent Developments or Updates\nRecent updates include:\n- Incremental reduction in hallucination rates (about 6-fold compared to prior best models).\n- More efficient compute usage, achieving better results with fewer tokens.\n- Expanded context windows up to 400k tokens for massive inputs.\n- Improved multimodal fusion for seamless text-image (and potential audio) integration.\n- Enhanced agentic capabilities for autonomous browsing and desktop setup.\n- Ongoing improvements in real-time routing between sub-models for optimized task handling.\n\nThe release date is 2025-08-07, positioning these as post-launch enhancements.\n\n### User Feedback and Adoption\nEarly testers and companies (e.g., Cursor and Windsurf) report GPT-5 (high) as remarkably intelligent, easier to steer, with a distinct personality unusual in prior models. It is recognized as state-of-the-art for coding and agentic tasks, with half the tool-calling error rate of frontier models. Community feedback praises its reliability, reduced hallucination rates, and expanded context capabilities, making it highly useful for professional and commercial applications. It is widely acknowledged as the most advanced OpenAI model to date, with strong adoption in reasoning, multimodal integration, and coding workflows. No quantitative adoption metrics are provided in the data.",
  "traces": [
    {
      "step": "Data Retrieval",
      "description": "Retrieving related model data from database",
      "tool": "Intelligent Query (google/gemini-2.5-flash-lite-preview-09-2025)",
      "status": "success"
    },
    {
      "step": "Web Research",
      "description": "Searching for additional model information",
      "tool": "Perplexity Sonar",
      "status": "success"
    },
    {
      "step": "Analysis Generation",
      "description": "Generating comprehensive model analysis with streaming",
      "tool": "x-ai/grok-4-fast",
      "status": "success"
    }
  ],
  "model_data": {
    "evaluations": {
      "aime": 0.957,
      "aime_25": 0.943,
      "artificial_analysis_coding_index": 52.7,
      "artificial_analysis_intelligence_index": 68.5,
      "artificial_analysis_math_index": 94.3,
      "gpqa": 0.854,
      "hle": 0.265,
      "ifbench": 0.731,
      "lcr": 0.756,
      "livecodebench": 0.846,
      "math_500": 0.994,
      "mmlu_pro": 0.871,
      "scicode": 0.429,
      "tau2": 0.848,
      "terminalbench_hard": 0.305
    },
    "id": "48e50f00-1fd1-4acc-b337-61078aa341e6",
    "median_output_tokens_per_second": 148.741,
    "median_time_to_first_answer_token": 57.845,
    "median_time_to_first_token_seconds": 57.845,
    "model_creator": {
      "id": "e67e56e3-15cd-43db-b679-da4660a69f41",
      "name": "OpenAI",
      "slug": "openai"
    },
    "name": "GPT-5 (high)",
    "pricing": {
      "price_1m_blended_3_to_1": 3.438,
      "price_1m_input_tokens": 1.25,
      "price_1m_output_tokens": 10
    },
    "release_date": "2025-08-07",
    "slug": "gpt-5"
  },
  "saved_at": "2025-10-11T16:32:51.179304"
}