{
  "model_name": "Anthropic: Claude Sonnet 4.5",
  "model_type": "openrouter",
  "analysis": "## Model Overview\n\n- **Name, Creator, and Category**: The model is named Anthropic: Claude Sonnet 4.5 (base name: Claude Sonnet 4.5), developed by Anthropic. It falls into the category of a hybrid reasoning large language model, specifically optimized for advanced coding, complex agentic workflows, and extended autonomous operations.\n\n- **Key Specifications and Capabilities**: Claude Sonnet 4.5 features a context length of 1,000,000 tokens (as per database specs; note that additional web research indicates a 200,000-token context window). It supports input modalities including text, image, and file, with a modality of text+image->text, and outputs text only. The tokenizer is Claude. Default parameters include a temperature of 1 and top_p of 1. It excels in real-world agents and coding workflows, delivering state-of-the-art performance on coding benchmarks like SWE-bench Verified. Key capabilities include improvements in system design, code security, specification adherence, extended autonomous operation (up to 30 hours), task continuity across sessions, fact-based progress tracking, tool orchestration, speculative parallel execution, efficient context and memory management, and enhanced awareness of token usage across tool calls. It supports multiple programming languages such as Python, JavaScript, TypeScript, Java, C++, Go, Rust, Swift, and Kotlin, with strong agentic features for multi-context and long-running workflows.\n\n## Performance Analysis\n\n- **Benchmarks and Scores**: On SWE-bench Verified, it achieves 77.2% in standard runs and 82.0% with parallel compute. For Terminal-Bench (command-line work), it scores 50.0%. It demonstrates improved real-world coding reliability, including issue resolution on real GitHub projects and reduced internal code editing error rates from 9% to 0%. It shows state-of-the-art performance in system design, code security, and specification adherence.\n\n- **Comparisons with Similar Models**: It outperforms previous Claude models and slightly exceeds GPT-5 Codexâs 74.5% on SWE-bench coding tasks. No other direct comparisons with similar models are provided in the data.\n\n## Technical Details\n\n- **Architecture Insights**: The architecture is a hybrid reasoning large language model building upon the Claude 4 architecture, with enhancements in coding and agentic applications. It includes advanced protections for alignment and behavior safety to reduce misaligned outputs. Supported parameters include include_reasoning, max_tokens, reasoning, stop, temperature, tool_choice, tools, top_k, and top_p. The instruct_type is null. Maximum completion tokens are 64,000.\n\n- **Input/Output Specifications**: Inputs support text, image, and file modalities, processed as text+image->text. Outputs are text only. The context length is 1,000,000 tokens (database spec), enabling processing of large documents without fragmentation (web research notes 200,000 tokens for this purpose). It supports multi-tool simultaneous usage, speculative parallel execution, and improved memory handling with checkpoints to save and roll back code states.\n\n## Pricing & Availability\n\n- **Cost Structure and Pricing Tiers**: Pricing is $0.000003 per input token (prompt) and $0.000015 per completion token, equivalent to approximately $3 per million input tokens and $15 per million output tokens (maintaining the same rate as Claude Sonnet 4). No costs for image, internal reasoning, requests, or web search. No per-request limits or additional tiers are specified.\n\n- **Availability and Access Methods**: Available via the Claude API, integrated into Amazon Bedrock for enterprise-grade services, Vertex AI, Chrome extensions (for Max users), and native apps. It includes developer tools such as code checkpoints, VS Code extension, Claude Agent SDK, enhanced terminal interface, and file creation functionality in conversations. The display URL is https://openrouter.ai/models/anthropic/claude-4.5-sonnet-20250929, with slug anthropic/claude-4.5-sonnet-20250929. No Hugging Face ID is provided. The top provider offers 1,000,000 context length and is not moderated.\n\n## Use Cases & Applications\n\n- **Recommended Applications Based on Performance Data**: Ideal for software engineering (autonomous multi-day coding projects including planning, coding, testing, bug fixing, and documentation), cybersecurity, financial analysis, research agents, architecture and engineering (rapid concept generation, parametric design, document analysis, BIM standard automation), and complex agent workflows requiring sustained reasoning and tool use. It supports long-running autonomous AI agents for multi-context tasks, handling extensive projects with multi-file dependencies.\n\n- **Strengths and Limitations**: Strengths include leading coding performance (e.g., 77.2-82.0% on SWE-bench), extended autonomous operation (up to 30 hours, 4x improvement over prior limits), enhanced tool handling (multi-tool use, parallel execution), reduced coding errors (0% in internal editing), broad language support, and efficient memory/context management for workflows like GitHub issue resolution. Limitations are not explicitly detailed in the provided data, though its focus on agentic and coding tasks may imply less emphasis on non-technical creative or general conversational applications; the model is not moderated, which could affect output safety in unguided use.\n\n## Community & Updates\n\n- **Recent Developments or Updates**: Created on 1759161676 (timestamp). Recent improvements include extended autonomous operation to 30 hours, introduction of model checkpoints for code state management, enhanced memory tools for longer sessions, new Claude Agent SDK for complex agent development, speculative parallel execution and multi-tool use, better token usage tracking, expanded programming language support, reduced coding errors, and expanded context editing with direct file creation (e.g., spreadsheets, documents, slides) in chat interfaces. Continuous updates and SDK support are provided.\n\n- **User Feedback and Adoption**: Specific user reviews are not publicly detailed in the search results. However, internal testing and third-party assessments indicate strong developer satisfaction, reflected in reliability (e.g., zero error rates in code editing) and wide adoption in architectural, BIM management, and software development scenarios. Feedback highlights ease of use with tools like VS Code extensions and the Claude Agent SDK, boosting productivity for complex autonomous workflows. The large context window and extended runtime are particularly appreciated for handling extensive projects and multi-file dependencies, as noted by architects and BIM managers. No related models were discovered, suggesting standalone prominence in its category.",
  "traces": [
    {
      "step": "Data Retrieval",
      "description": "Retrieving related model data from database",
      "tool": "Intelligent Query (google/gemini-2.5-flash-lite-preview-09-2025)",
      "status": "success"
    },
    {
      "step": "Web Research",
      "description": "Searching for additional model information",
      "tool": "Perplexity Sonar",
      "status": "success"
    },
    {
      "step": "Analysis Generation",
      "description": "Generating comprehensive model analysis with streaming",
      "tool": "x-ai/grok-4-fast",
      "status": "success"
    }
  ],
  "model_data": {
    "architecture": {
      "input_modalities": [
        "text",
        "image",
        "file"
      ],
      "instruct_type": null,
      "modality": "text+image->text",
      "output_modalities": [
        "text"
      ],
      "tokenizer": "Claude"
    },
    "base_name": "Claude Sonnet 4.5",
    "context_length": 1000000,
    "created": 1759161676,
    "default_parameters": {
      "frequency_penalty": null,
      "temperature": 1,
      "top_p": 1
    },
    "description": "Claude Sonnet 4.5 is Anthropic’s most advanced Sonnet model to date, optimized for real-world agents and coding workflows. It delivers state-of-the-art performance on coding benchmarks such as SWE-bench Verified, with improvements across system design, code security, and specification adherence. The model is designed for extended autonomous operation, maintaining task continuity across sessions and providing fact-based progress tracking.\n\nSonnet 4.5 also introduces stronger agentic capabilities, including improved tool orchestration, speculative parallel execution, and more efficient context and memory management. With enhanced context tracking and awareness of token usage across tool calls, it is particularly well-suited for multi-context and long-running workflows. Use cases span software engineering, cybersecurity, financial analysis, research agents, and other domains requiring sustained reasoning and tool use.",
    "display_url": "https://openrouter.ai/models/anthropic/claude-4.5-sonnet-20250929",
    "hugging_face_id": "",
    "id": "anthropic/claude-sonnet-4.5",
    "name": "Anthropic: Claude Sonnet 4.5",
    "per_request_limits": null,
    "pricing": {
      "completion": "0.000015",
      "image": "0",
      "internal_reasoning": "0",
      "prompt": "0.000003",
      "request": "0",
      "web_search": "0"
    },
    "slug": "anthropic/claude-4.5-sonnet-20250929",
    "supported_parameters": [
      "include_reasoning",
      "max_tokens",
      "reasoning",
      "stop",
      "temperature",
      "tool_choice",
      "tools",
      "top_k",
      "top_p"
    ],
    "tags": [],
    "top_provider": {
      "context_length": 1000000,
      "is_moderated": false,
      "max_completion_tokens": 64000
    },
    "vendor": "Anthropic"
  },
  "saved_at": "2025-10-11T16:58:15.519857"
}