{
  "model_name": "Google: Gemini 2.5 Flash Image (Nano Banana)",
  "model_type": "openrouter",
  "analysis": "## Model Overview\n\n### Name, Creator, and Category\nThe model is named **Google: Gemini 2.5 Flash Image (Nano Banana)**, with the base name **Gemini 2.5 Flash Image (Nano Banana)** and ID **google/gemini-2.5-flash-image**. It is created by **Google**, as indicated by the vendor field. This model falls into the category of a multimodal AI, specifically a state-of-the-art image generation and editing model with contextual understanding, supporting both text and image modalities for generation, edits, and multi-turn conversations.\n\n### Key Specifications and Capabilities\n- **Context Length**: 32768 tokens.\n- **Modalities**: Supports input modalities of image and text, with output modalities of image and text. The overall modality is described as \"text+image->text+image\".\n- **Capabilities**: It excels in image generation, pixel-perfect editing via natural language commands, multi-image fusion (blending multiple images into one seamless visual), and maintaining character and style consistency across iterations. It handles multi-turn conversations, precise alterations to image elements (e.g., changing expressions or colors without affecting the rest of the image), and aspect ratio control via the [image_config API Parameter](https://openrouter.ai/docs/features/multimodal/image-generation#image-aspect-ratio-configuration).\n- **Other Features**: Each generated image uses approximately 1290 output tokens and includes an invisible SynthID digital watermark for identifying AI-generated content. It supports iterative image generation for breaking down complex tasks and integrates with tools like Google AI Studio and Vertex AI.\n- **Parameters**: Default parameters include null values for frequency_penalty, temperature, and top_p. Supported parameters are max_tokens, response_format, seed, structured_outputs, temperature, and top_p. The instruct_type is null.\n- **Tokenizer**: Gemini.\n\n## Performance Analysis\n\n### Benchmarks and Scores\nNo specific benchmarks or numerical scores (e.g., quantitative metrics like FID scores or edit success rates) are provided in the data. The model is described as state-of-the-art (SOTA) for image generation and editing tasks, with improvements in image quality, creative controls, and consistency over prior versions.\n\n### Comparisons with Similar Models\nThe data mentions comparisons primarily to **Gemini 2.0 Flash**, noting that Gemini 2.5 Flash Image offers higher image quality, more powerful creative controls, and more reliable maintenance of scene and character consistency, reducing subtle flaws in repeated generations. It is part of the Gemini 2.5 family, optimized for low latency and cost-efficiency compared to earlier iterations. No other related models were discovered, and no direct comparisons to non-Google models are available in the provided data.\n\n## Technical Details\n\n### Architecture Insights\nThe architecture supports multimodal inputs and outputs, with input modalities including image and text, and output modalities including image and text. It is designed for contextual understanding in image generation and editing, enabling features like multi-image fusion, pixel-perfect editing through natural language instructions, and preservation of identity in characters and styles. The model is optimized for low latency within the Gemini 2.5 family. Integration is available via Google AI Studio, Vertex AI, and the Gemini API. The tokenizer is specified as \"Gemini\". Hugging Face ID is empty, indicating no direct Hugging Face hosting in the data.\n\n### Input/Output Specifications\n- **Inputs**: Text and image; supports multi-turn conversations and natural language commands for editing (e.g., altering specific elements like a dog's expression or furniture color).\n- **Outputs**: Text and image; generates images with controllable aspect ratios, each consuming about 1290 output tokens. Outputs include AI-generated images with SynthID watermarking. Maximum completion tokens: 8192 (from top_provider). The model handles iterative workflows, remembering previous content context for series of edits.\n- **Other Specs**: Context length of 32768 tokens. Per-request limits are null. Created timestamp: 1759870431. Top provider details: context_length 32768, is_moderated false, max_completion_tokens 8192.\n\n## Pricing & Availability\n\n### Cost Structure and Pricing Tiers\nPricing is token-based and multimodal-specific:\n- **Prompt**: $0.0000003 (likely per token).\n- **Completion**: $0.0000025 (likely per token).\n- **Image**: $0.001238 (specific to image generation).\n- **Internal Reasoning**: $0 (no cost).\n- **Request**: $0 (no cost).\n- **Web Search**: $0 (no cost).\n\nAdditional context from the data translates this to approximately $30 per 1 million output tokens, or roughly $0.039 per image (based on ~1290 tokens per image). Other Gemini 2.5 Flash modalities follow similar structures. No explicit pricing tiers (e.g., free vs. paid plans) are detailed, but it is positioned as cost-effective.\n\n### Availability and Access Methods\nThe model is generally available now, accessible via **Google AI Studio**, **Gemini API**, and **Vertex AI** platform. It is also available through OpenRouter (display_url: https://openrouter.ai/models/google/gemini-2.5-flash-image). Developers and enterprise customers can deploy apps directly or export code to GitHub. Google AI Studio includes a \"build mode\" for easier app creation and rapid prototyping. No per-request limits are specified (null). Tags are empty, and it is not moderated (is_moderated: false).\n\n## Use Cases & Applications\n\n### Recommended Applications Based on Performance Data\n- **Creative Content Creation**: Marketing visuals, training materials, advertisements, and storytelling with persistent character likeness and scenes, leveraging multi-image fusion and consistency.\n- **Photo and Image Editing**: Conversational edits using natural language (e.g., changing expressions, colors, or small details like logos/buttons in UI/UX mockups) without global disruptions.\n- **Iterative Design Workflows**: Breaking down complex tasks, such as progressively decorating rooms or generating series of images that remember prior context.\n- **UI/UX Design**: Pixel-perfect alterations to mockups, maintaining layout integrity.\n- **Fun and Viral Applications**: Turning photos into figurines or other creative transformations, as noted in community use.\n\nThese are recommended based on the model's strengths in generation, editing, and multi-turn capabilities.\n\n### Strengths and Limitations\n- **Strengths**: High-quality image generation with low latency; excellent character and style consistency; pixel-perfect, natural language-based editing; multi-image fusion for seamless blending; cost-effectiveness; accurate text rendering in images; supports aspect ratio control and iterative workflows. It reduces flaws in repeated generations and enables precise, subtle modifications.\n- **Limitations**: No specific limitations are explicitly stated in the data. However, as an optimized \"Flash\" model, it may prioritize speed over the highest fidelity in extremely complex scenarios (inferred from family description, but not directly stated). Related models are none, so no comparative limitations. Pricing is low but accumulates with token usage for high-volume image generation.\n\n## Community & Updates\n\n### Recent Developments or Updates\nThe model has progressed from Gemini 2.0 Flash, with key updates including improved image quality, enhanced creative controls, support for multi-image fusion, better character consistency, and pixel-perfect editing. It now better renders text within images and allows precise changes to small details without affecting the overall image. Google AI Studio's \"build mode\" has been significantly updated for easier app creation and rapid prototyping. It is now generally available, with accessibility via multiple Google platforms. Each image includes SynthID watermarking as a recent standard feature.\n\n### User Feedback and Adoption\nUser reviews highlight appreciation for the model's low latency and cost-effectiveness. Positive feedback emphasizes its ability to maintain character consistency across edits (a common weakness in other models), pixel-perfect editing for detailed modifications, and contextual memory in iterative generations for complex workflows. The Viral Gemini App community particularly enjoys fun use cases like turning photos into figurines. Adoption is strong among developers and enterprises, with tools for direct deployment and GitHub export facilitating broader use. No negative feedback or adoption metrics (e.g., user numbers) are provided in the data.",
  "traces": [
    {
      "step": "Data Retrieval",
      "description": "Retrieving related model data from database",
      "tool": "Intelligent Query (google/gemini-2.5-flash-lite-preview-09-2025)",
      "status": "success"
    },
    {
      "step": "Web Research",
      "description": "Searching for additional model information",
      "tool": "Perplexity Sonar",
      "status": "success"
    },
    {
      "step": "Analysis Generation",
      "description": "Generating comprehensive model analysis with streaming",
      "tool": "x-ai/grok-4-fast",
      "status": "success"
    }
  ],
  "model_data": {
    "architecture": {
      "input_modalities": [
        "image",
        "text"
      ],
      "instruct_type": null,
      "modality": "text+image->text+image",
      "output_modalities": [
        "image",
        "text"
      ],
      "tokenizer": "Gemini"
    },
    "base_name": "Gemini 2.5 Flash Image (Nano Banana)",
    "context_length": 32768,
    "created": 1759870431,
    "default_parameters": {
      "frequency_penalty": null,
      "temperature": null,
      "top_p": null
    },
    "description": "Gemini 2.5 Flash Image, a.k.a. \"Nano Banana,\" is now generally available. It is a state of the art image generation model with contextual understanding. It is capable of image generation, edits, and multi-turn conversations. Aspect ratios can be controlled with the [image_config API Parameter](https://openrouter.ai/docs/features/multimodal/image-generation#image-aspect-ratio-configuration)",
    "display_url": "https://openrouter.ai/models/google/gemini-2.5-flash-image",
    "hugging_face_id": "",
    "id": "google/gemini-2.5-flash-image",
    "name": "Google: Gemini 2.5 Flash Image (Nano Banana)",
    "per_request_limits": null,
    "pricing": {
      "completion": "0.0000025",
      "image": "0.001238",
      "internal_reasoning": "0",
      "prompt": "0.0000003",
      "request": "0",
      "web_search": "0"
    },
    "slug": "google/gemini-2.5-flash-image",
    "supported_parameters": [
      "max_tokens",
      "response_format",
      "seed",
      "structured_outputs",
      "temperature",
      "top_p"
    ],
    "tags": [],
    "top_provider": {
      "context_length": 32768,
      "is_moderated": false,
      "max_completion_tokens": 8192
    },
    "vendor": "Google"
  },
  "saved_at": "2025-10-11T16:20:55.872389"
}